{
  "title": "通信噪声如何影响信息传输",
  "core_message": "发送端通过通信信道把信息传给接收端，通信噪声是传输中对信号的干扰，可能使接收端收到的信息与发送端不同，但不表示每次传输都会出错。",
  "necessary_points": [
    {
      "point": "发送端通过通信信道把信息传给接收端",
      "source_quotes": [
        "发送端通过通信信道把信息传给接收端"
      ]
    },
    {
      "point": "通信噪声是传输过程中对信号产生的干扰",
      "source_quotes": [
        "通信噪声是传输过程中对信号产生的干扰"
      ]
    },
    {
      "point": "受噪声影响，接收端收到的信息可能与发送端发出的信息不同",
      "source_quotes": [
        "受到噪声影响后，接收端收到的信息可能与发送端发出的信息不同"
      ]
    },
    {
      "point": "噪声带来差错的可能性，但不表示每次传输都会出错",
      "source_quotes": [
        "噪声带来差错的可能性，但不表示每次传输都会出错"
      ]
    }
  ],
  "omissions": [
    "未加入概率、统计数字、具体设备、纠错方法或现实案例。",
    "未说明通信信道和噪声的具体物理形式。",
    "未将抽象图形说明为真实传输画面。"
  ],
  "ambiguities": [
    "材料未说明噪声导致差错的可能性大小。",
    "材料未说明不同信道或不同噪声下的具体结果。",
    "概念示意未指定具体图形或信号形式。"
  ],
  "segments": [
    {
      "id": "n1",
      "text": "发送端通过通信信道，把信息传给接收端。",
      "source_quotes": [
        "发送端通过通信信道把信息传给接收端"
      ]
    },
    {
      "id": "n2",
      "text": "通信噪声是传输中对信号的干扰。",
      "source_quotes": [
        "通信噪声是传输过程中对信号产生的干扰"
      ]
    },
    {
      "id": "n3",
      "text": "受噪声影响，接收端收到的信息可能与发送端不同。",
      "source_quotes": [
        "受到噪声影响后，接收端收到的信息可能与发送端发出的信息不同"
      ]
    },
    {
      "id": "n4",
      "text": "噪声带来差错可能，但不表示每次传输都会出错。",
      "source_quotes": [
        "噪声带来差错的可能性，但不表示每次传输都会出错"
      ]
    }
  ]
}
